{
  "version": "v1",
  "name": "BTC Multi-Source Stream",
  "description": "Combines BTC price from exchanges, Twitter sentiment, and Solana on-chain activity",
  "sources": [
    {
      "type": "ccxt",
      "symbols": ["BTC/USDT"]
    },
    {
      "type": "twitter",
      "symbols": ["BTC"]
    },
    {
      "type": "onchain",
      "chain": "sol",
      "event_types": ["tx", "transfer"]
    }
  ],
  "interval_sec": 5,
  "symbols": ["BTC/USDT"]
}
